{
  "@id": "https://example.gov/series/annual-climate-observations",
  "@type": "DatasetSeries",
  "title": "Annual National Climate Observations Series",
  "description": "An annual series of comprehensive climate observation datasets collected from monitoring stations across the United States. Each dataset in the series covers one calendar year of daily observations.",
  "accrualPeriodicity": "annually",
  "issued": "2000-01-15",
  "modified": "2025-06-01",
  "publisher": {
    "@id": "https://example.gov/agents/ncdc",
    "@type": "Agent",
    "name": "National Climate Data Center",
    "category": [
      {
        "@id": "https://example.gov/concepts/federal-agency",
        "@type": "Concept",
        "prefLabel": "Federal Agency",
        "definition": "An agency of the federal government of the United States.",
        "inScheme": {
          "@id": "https://example.gov/concept-schemes/organization-types",
          "@type": "ConceptScheme",
          "title": "Organization Types"
        }
      }
    ]
  },
  "contactPoint": [
    {
      "@id": "https://example.gov/contacts/series-manager",
      "@type": "Kind",
      "fn": "Climate Series Data Manager",
      "hasEmail": "mailto:climate-series@example.gov",
      "organization-name": "National Climate Data Center",
      "tel": "+1-555-123-4567",
      "title": "Series Data Manager",
      "address": [
        {
          "@id": "https://example.gov/addresses/ncdc-main",
          "@type": "Address",
          "street-address": "151 Patton Avenue",
          "locality": "Asheville",
          "region": "NC",
          "postal-code": "28801",
          "country-name": "United States"
        }
      ]
    }
  ],
  "spatial": [
    {
      "@id": "https://example.gov/locations/usa-coverage",
      "@type": "Location",
      "geometry": "POLYGON((-125 24, -66 24, -66 50, -125 50, -125 24))"
    }
  ],
  "temporal": [
    {
      "@id": "https://example.gov/periods/series-coverage",
      "@type": "PeriodOfTime",
      "startDate": "2000-01-01",
      "endDate": "2025-12-31"
    }
  ],
  "first": {
    "@id": "https://example.gov/datasets/climate-observations-2000",
    "@type": "Dataset",
    "title": "National Climate Observations 2000",
    "description": "The first dataset in the annual climate observations series, covering calendar year 2000.",
    "contactPoint": {
      "fn": "Climate Data Support",
      "hasEmail": "mailto:climate@example.gov"
    },
    "publisher": {
      "name": "National Climate Data Center"
    },
    "identifier": "https://example.gov/datasets/series-first",
    "distribution": [
      {
        "@id": "https://example.gov/distributions/climate-2000-csv",
        "@type": "Distribution",
        "title": "Climate Observations 2000 CSV",
        "description": "Climate observations for 2000 in CSV format",
        "downloadURL": "https://example.gov/downloads/climate-observations-2000.csv",
        "mediaType": "text/csv"
      }
    ]
  },
  "last": {
    "@id": "https://example.gov/datasets/climate-observations-2025",
    "@type": "Dataset",
    "title": "National Climate Observations 2025",
    "description": "The most recent dataset in the annual climate observations series, covering calendar year 2025.",
    "contactPoint": {
      "fn": "Climate Data Support",
      "hasEmail": "mailto:climate@example.gov"
    },
    "publisher": {
      "name": "National Climate Data Center"
    },
    "identifier": "https://example.gov/datasets/series-last-2025",
    "distribution": [
      {
        "@id": "https://example.gov/distributions/climate-2025-csv",
        "@type": "Distribution",
        "title": "Climate Observations 2025 CSV",
        "description": "Climate observations for 2025 in CSV format",
        "downloadURL": "https://example.gov/downloads/climate-observations-2025.csv",
        "mediaType": "text/csv"
      }
    ]
  },
  "seriesMember": [
    {
      "@id": "https://example.gov/datasets/climate-observations-2022",
      "@type": "Dataset",
      "title": "National Climate Observations 2022",
      "description": "Climate observations for calendar year 2022.",
      "contactPoint": {
        "fn": "Climate Data Support",
        "hasEmail": "mailto:climate@example.gov"
      },
      "publisher": {
        "name": "National Climate Data Center"
      },
      "identifier": "https://example.gov/datasets/series-member-001",
      "distribution": [
        {
          "@id": "https://example.gov/distributions/climate-2022-csv",
          "@type": "Distribution",
          "title": "Climate Observations 2022 CSV",
          "description": "Climate observations for 2022 in CSV format",
          "downloadURL": "https://example.gov/downloads/climate-observations-2022.csv",
          "mediaType": "text/csv"
        }
      ]
    },
    {
      "@id": "https://example.gov/datasets/climate-observations-2023",
      "@type": "Dataset",
      "title": "National Climate Observations 2023",
      "description": "Climate observations for calendar year 2023.",
      "contactPoint": {
        "fn": "Climate Data Support",
        "hasEmail": "mailto:climate@example.gov"
      },
      "publisher": {
        "name": "National Climate Data Center"
      },
      "identifier": "https://example.gov/datasets/series-member-002",
      "distribution": [
        {
          "@id": "https://example.gov/distributions/climate-2023-csv",
          "@type": "Distribution",
          "title": "Climate Observations 2023 CSV",
          "description": "Climate observations for 2023 in CSV format",
          "downloadURL": "https://example.gov/downloads/climate-observations-2023.csv",
          "mediaType": "text/csv"
        }
      ]
    },
    {
      "@id": "https://example.gov/datasets/climate-observations-2024",
      "@type": "Dataset",
      "title": "National Climate Observations 2024",
      "description": "Climate observations for calendar year 2024.",
      "contactPoint": {
        "fn": "Climate Data Support",
        "hasEmail": "mailto:climate@example.gov"
      },
      "publisher": {
        "name": "National Climate Data Center"
      },
      "identifier": "https://example.gov/datasets/series-member-003",
      "distribution": [
        {
          "@id": "https://example.gov/distributions/climate-2024-series-csv",
          "@type": "Distribution",
          "title": "Climate Observations 2024 Series CSV",
          "description": "Climate observations for 2024 in CSV format",
          "downloadURL": "https://example.gov/downloads/climate-observations-2024-series.csv",
          "mediaType": "text/csv"
        }
      ]
    }
  ]
}
